{
  "candidate_id": "cand_00000002-0000-4000-8000-000000000002",
  "confidence": null,
  "conflicts": [],
  "created_at": "2026-07-02T12:10:00.000Z",
  "declassification_approval_id": null,
  "dedupe_fingerprint": "dca3ae268ca8eb63a8eaf8f816e5beb42918bd637b09c88d125c410a654ebc58",
  "evidence": [
    {
      "evidence_class": "user_statement",
      "locator": {
        "kind": "json_pointer",
        "pointer": "/mapping/b1/message/content"
      },
      "object_hash": "1bcb7e22aeceeedc14a62c504fbb3d1e0af52c2cb7e229c4a2c902c8745b7298",
      "source_id": "src_00000002-0000-4000-8000-000000000002",
      "source_revision": 1,
      "supports": "content"
    }
  ],
  "expected_revision": null,
  "extensions": {},
  "extraction_run_id": "ext_00000002-0000-4000-8000-000000000002",
  "merged_into": null,
  "origin_actor": {
    "actor_id": "prn_00000002-0000-4000-8000-000000000002",
    "actor_type": "system"
  },
  "origin_kind": "rule_extraction",
  "proposal_kind": "create",
  "proposed_content": "MoriMeta 的视觉设计方向确定为 Professional Darkroom。",
  "proposed_details": null,
  "proposed_effective_from": null,
  "proposed_type": "project_state",
  "reason": "synthetic fixture proposal",
  "reopens_candidate_id": null,
  "resolution_review_id": null,
  "revision": 1,
  "schema_version": 1,
  "sensitivity": "private",
  "source_id": "src_00000002-0000-4000-8000-000000000002",
  "status": "pending",
  "target_identity_id": null,
  "target_memory_id": null,
  "updated_at": "2026-07-02T12:10:00.000Z",
  "context_source_refs": [
    {
      "source_id": "src_00000001-0000-4000-8000-000000000001",
      "source_revision": 1
    }
  ]
}
