{
  "candidate_id": "cand_00000066-0000-4000-8000-000000000066",
  "confidence": null,
  "conflicts": [],
  "created_at": "2026-09-20T09:00:00.000Z",
  "declassification_approval_id": null,
  "dedupe_fingerprint": "b391b0af2c2ef9b65692b1e2b40356f98083ab0bad7c699fdc26390c062a00b5",
  "evidence": [
    {
      "evidence_class": "user_statement",
      "locator": {
        "kind": "manual_input"
      },
      "object_hash": "5ac48b3ceaf8c69a466a0a57363b733854715c1990f11c4cd7dc41efb73cd5eb",
      "source_id": "src_00000066-0000-4000-8000-000000000066",
      "source_revision": 1,
      "supports": "content"
    }
  ],
  "expected_revision": 1,
  "extensions": {},
  "extraction_run_id": null,
  "merged_into": null,
  "origin_actor": {
    "actor_id": "prn_00000001-0000-4000-8000-000000000001",
    "actor_type": "owner"
  },
  "origin_kind": "owner_manual",
  "proposal_kind": "supersede",
  "proposed_content": "从 12 月 1 日起改用 Zed。",
  "proposed_details": null,
  "proposed_effective_from": "2026-12-01T00:00:00.000Z",
  "proposed_type": "fact",
  "reason": "synthetic fixture proposal",
  "reopens_candidate_id": null,
  "resolution_review_id": null,
  "revision": 1,
  "schema_version": 1,
  "sensitivity": "private",
  "source_id": "src_00000066-0000-4000-8000-000000000066",
  "status": "pending",
  "target_identity_id": null,
  "target_memory_id": "mem_00000065-0000-4000-8000-000000000065",
  "updated_at": "2026-09-20T09:00:00.000Z"
}
